Sun Nov 24 20:24:05 +0000 2019,jlespert,"Un imbécil importante, bueno para nada. Debería devolver todo lo que cobró estos años por su ""invalorable"" aporte a la patria https://t.co/JLtsOhls57",780,92
Thu Nov 21 20:21:33 +0000 2019,jlespert,La política tradicional de Argentina siempre tiene argumentos para hacer lo que está mal y excusas para no hacer lo necesario y que algún día nos vaya bien. Impresentables,2624,482
Thu Nov 21 20:13:04 +0000 2019,jlespert,Cambiemitas y Kirchneristas votaron a favor de este otro adefesio. Pero eran diferentes 😖 y pretenden ser oposición a Fernández. Hipócritas https://t.co/0MKptnEjIT vía @Ambitocom,897,178
Thu Nov 21 13:13:59 +0000 2019,jlespert,Gracias Marce querido! Abrazo https://t.co/00TTLWRjpP,349,17
Thu Nov 21 03:57:16 +0000 2019,jlespert,Macristas y kirchneristas votaron esta bazofia. Y despues pretenden hacerte creer que son algo diferente. Caraduras https://t.co/MfqLNCCVUw,5231,1113
Wed Nov 20 14:38:20 +0000 2019,jlespert,"Estos tipos de la vieja política siempre diciendo las mismas estupideces e hipocrecías. El no ajuste fiscal del cual habla Fernández, es no bajar el gasto público. O sea, es cobrarle más impuestos a los que trabajan (Macri) o hambrearlo con devaluaciones (Macri). La falsa grieta https://t.co/odsb3IisnN",2196,439
Wed Nov 20 10:11:37 +0000 2019,jlespert,Y volvieron nomás. Gracias Mauri! https://t.co/T030XLM5N3,6283,966
Wed Nov 20 02:09:01 +0000 2019,jlespert,Video de mi participación esta noche en #PolemicaEnElBar junto a @iudica por @AmericaTV   👇🏻 https://t.co/92nAAWQZbG,154,23
Tue Nov 19 16:47:10 +0000 2019,jlespert,Esta noche a las 20HS estaré en #PolemicaEnElBar con @iudica por @AmericaTV https://t.co/1xDwCdIvGK,166,17
Tue Nov 19 09:29:05 +0000 2019,jlespert,Sería una pésima noticia https://t.co/xXFzFmzgEw,7180,1118
Tue Nov 19 02:52:07 +0000 2019,jlespert,Video con mi participación de recién en @Intratables con @fabdoman por @AmericaTV https://t.co/nnuB9zpcYQ,144,18
Mon Nov 18 15:01:38 +0000 2019,jlespert,Esta noche a las 22:30HS estaré en @Intratables con @fabdoman por @AmericaTV https://t.co/n3ESOpNo1X,314,41
Mon Nov 18 12:13:51 +0000 2019,jlespert,"Las mismas estupideces de siempre. Duhalde, Kirchner, Macri, Fernández. No importa quien gobierne. Ninguno baja el gasto público en serio, todos suben impuestos, en particular, retenciones a las exportaciones. Inviables https://t.co/wwFS1KN3W1 vía @LANACION",2733,617
Mon Nov 18 10:00:42 +0000 2019,jlespert,Video de mi participación anoche en el programa @DeboDecirOK de @luisnovaresio por @AmericaTV  👇🏻 https://t.co/vx9KYGdUJh,71,9
Sun Nov 17 22:30:54 +0000 2019,jlespert,Esta noche a las 22HS estaré con @luisnovaresio en @DeboDecirOK por @AmericaTV https://t.co/fKCNprnvP4,279,41
Sun Nov 17 12:48:23 +0000 2019,jlespert,"Este hombre no está bien. Fracasó para lo único que fue votado en 2015, terminar con el kirchnerismo, pero hoy dice que ""esto"" recién empieza"" https://t.co/Dexptcpzq3",4387,694
Sun Nov 17 12:37:34 +0000 2019,jlespert,Sólo en legisladores provinciales (hay que agregar el Congreso Nacional y los Consejos Deliberantes) la gente de trabajo paga impuestos por $43.000 millones al año. Las provincias que no puedan pagarse sus gastos con recursos propios deberían fusionarse. Basta de curros. https://t.co/YPBLh17SF9,2390,699
Sat Nov 16 09:07:27 +0000 2019,jlespert,Video con mi participación anoche en #AnimalesSueltos con @fantinofantino por @AmericaTV   👇🏻  https://t.co/0CX4zXG7m1,166,27
Sat Nov 16 00:35:29 +0000 2019,jlespert,¿Como se entiendo esto muchachi del campo? Las retenciones de Mauri son buenas pero no la de los orcos? https://t.co/tA4vR4IkMb,618,80
Sat Nov 16 00:22:32 +0000 2019,jlespert,Vamos Bolivia! https://t.co/1qNABoQg4I,3174,422
Fri Nov 15 23:34:50 +0000 2019,jlespert,Video de mi participación esta tarde en el programa #MasQueNoticias de Mauro Viale por @A24COM   👇🏻 https://t.co/jp4ydgfRys,77,15
Fri Nov 15 22:00:42 +0000 2019,jlespert,A las 23:15HS estaré en #AnimalesSueltos con @fantinofantino por @AmericaTV https://t.co/yJz4uB1FhS,168,21
Fri Nov 15 20:44:49 +0000 2019,jlespert,"Totalmente de acuerdo con A.Fernández...en la frase. Sospecho que discrepamos 100% en la solución. Él con proteccionismo industrial, subsidios, gasto fiscal, controles de precios, etc.. Yo con apertura comercial, bajos impuestos y leyes laborales amigables con el empleo https://t.co/RoqF55uPyP",3159,515
Fri Nov 15 20:00:54 +0000 2019,jlespert,A las 18HS estaré con #MauroViale por @A24COM https://t.co/DpOcoLV7ZT,107,12
Fri Nov 15 17:13:07 +0000 2019,jlespert,Leo que el plan contra el hambre de Alberto Fernández pretende que Precios Cuidados tenga status de Ley del Congreso. Un disparate monumental https://t.co/4khWVYA0xT,1485,295
Fri Nov 15 17:01:10 +0000 2019,jlespert,A las 18HS estaré con #MauroViale por @A24COM https://t.co/mtQnfrV1eQ,157,15
Fri Nov 15 00:49:59 +0000 2019,jlespert,"Claridad meridiana en Brasil. La condicion NECESARIA y no suficiente para detener la decadencia de nuestros países, tan pero tan cerrados al comercio, es justamente su inversa, el libre comercio https://t.co/JlP3XMCjPi",2920,371
Thu Nov 14 10:31:52 +0000 2019,jlespert,Cavernícola https://t.co/zRF9JVK0wC,1124,125
Thu Nov 14 10:26:16 +0000 2019,jlespert,"Un tipo que hizo todo, pero todo mal cuando fue Ministro, criticando a otros y as usual, diciendo la típica estupidez argenta de que todo lo que salió mal y fracasó, sin importar lo que sea, es por definición ""liberal"" https://t.co/fHTFzDTY3B",14699,3141
Thu Nov 14 10:18:52 +0000 2019,jlespert,"La Iglesia no tiene nada que hacer con asuntos de Estado y los piqueteros tienen que estar presos por cortar calles. Pero AF empodera a los dos. Gran tergiversación de roles, valores y conceptos. Así nos va https://t.co/BWYrq3I7Ws",3473,805
Wed Nov 13 21:46:19 +0000 2019,jlespert,Así nos va a ir mi querido https://t.co/9hXSvsESk5,9132,1173
Wed Nov 13 20:58:53 +0000 2019,jlespert,"Y al final, fundieron a todos. Inútiles https://t.co/EFSqcnCARx",773,113
Tue Nov 12 23:23:14 +0000 2019,jlespert,O sea que son brutos con ganas https://t.co/B2Z3iib7Jb,1497,250
Tue Nov 12 22:53:35 +0000 2019,jlespert,"La vuelta de los Buitres en la Argentina de ""El dia de la marmota"" (peli). Todo vuelve a repetirse y ya ni si quiera cambian las caras https://t.co/45G7IfgPE5",597,97
Tue Nov 12 20:14:40 +0000 2019,jlespert,"Para estas estupideces, estos impresentables a vos te roban el fruto de tu trabajo a impuestos. Habría que hacer como la legislatura de Texas (USA), funciona 6 meses a full, cada 2 años y sanciona todo lo necesario. Trabajen ladris https://t.co/VwO5IPvoVV",7613,2038
Tue Nov 12 16:12:35 +0000 2019,jlespert,Totalmente de acuerdo https://t.co/RMWqeODiNa,3791,772
Sun Nov 10 12:01:32 +0000 2019,jlespert,Ladri https://t.co/TrOGl9D9el,7343,700
Sat Nov 09 23:43:47 +0000 2019,jlespert,Retomamos a full con el gran @luisrosalesARG https://t.co/vQ8iWSVRXv,1344,76
Sat Nov 09 20:48:10 +0000 2019,jlespert,Banco a mi amiga Silvina Márquez. Persona limpia y de bien si las hay https://t.co/OXtCoiYV9Y,146,12
Sat Nov 09 20:40:45 +0000 2019,jlespert,Excelente https://t.co/wa4OgcnnRq,1073,129
Sat Nov 09 17:36:04 +0000 2019,jlespert,Señales cada vez más preocupantes del Presidente electo de Argentina https://t.co/nbMuxTPQ2E,32551,8784
Fri Nov 08 10:26:35 +0000 2019,jlespert,¿La herencia que deja Macri? Ahí la tenes https://t.co/dXdNwTdx4E,2375,333
Fri Nov 08 10:04:15 +0000 2019,jlespert,"Te podes ir de Argentina una década, volvés y los temas y los tics y los que gobiernan son los mismos. O sino, son otros que hacen lo mismo que los anteriores, motivo por el cual vuelven los anteriores. Y así. Tristeza https://t.co/xputqLtCxM",4836,974
Thu Nov 07 00:47:50 +0000 2019,jlespert,"Me ""destrozaron"" los fanaticos, dementes, los que son carne de cañon para cualquier aventura populista. Macri tenía un solo mandato: que no volvieran los K ¿Qué hizo? Gobernó pésimo y, obvio, volvieron los K. Nosotros tenemos que estar enojados con Uds. macristas, no al revés https://t.co/Pc2h0aAUE5",5997,979
Wed Nov 06 20:08:13 +0000 2019,jlespert,Audio de mi diálogo esta mañana con @luisnovaresio por @radiolared   👇🏻 https://t.co/54YUH0l7qe,103,17
Wed Nov 06 18:03:49 +0000 2019,jlespert,"Excelente @luisrosalesARG ""La extinción del mandato de Macri"" https://t.co/VNk1pv5rvO",308,63
Wed Nov 06 11:36:15 +0000 2019,jlespert,Excelente gestión. Felicitaciones! https://t.co/2xnDxktLIk,3289,291
Wed Nov 06 01:17:58 +0000 2019,jlespert,Argentina 360 grados https://t.co/Lxp6JTxKVl,707,85
Tue Nov 05 19:58:21 +0000 2019,jlespert,"El macrismo dice que hablará de la herencia que le deja al kirchnerismo. No engañen más a la gente muchachos. El único mandato que Uds. tenían era que #NoVuelvenMas y por culpa del pésimo gobierno que hicieron, volvieron. LA herencia de Uds. el el kirchnerismo otra vez gobernando",13111,2357
Sun Nov 03 12:46:07 +0000 2019,jlespert,"""Argentina no tiene solución"", la dura columna del diario La Vanguardia https://t.co/n9OIt5iFR2",1310,315
Sat Nov 02 11:41:59 +0000 2019,jlespert,Comentario ridículo si los hay Mr. President. Usted debería poder más que eso https://t.co/aLCjqeTHC9,11007,1396
Fri Nov 01 14:59:18 +0000 2019,jlespert,"Actitud fuera de lugar de Bolsonaro. Lo prudente sería esperar que AF asuma, lo vea actuar a AF y luego actuar él https://t.co/ijWBcCwipv",3660,339
Thu Oct 31 23:53:06 +0000 2019,jlespert,Estoy de acuerdo. No cualquiera logra el milagro de transformar un pais rico en miserable. Santa Evita https://t.co/vEdkwOlHCp,28343,6612
Thu Oct 31 22:50:21 +0000 2019,jlespert,"Consecuencias cada vez peores de una campaña electoral absolutamente irresponsable del kirchnerismo de buenos modales macrista que, por si fuera poco, nos devolvió a los kirchneristas originales desde el pasado 27-10 https://t.co/nXLBThYeLG",2884,531
Tue Oct 29 23:12:26 +0000 2019,jlespert,"El gobierno pasó de decir antes de las PASO en un video que yo era el principal candidato de Cristina a ""hacerme"" afirmar ahora (post derrota el 27) por WS que para mí Macri es la real oposición a Alberto Fernández. Muchachos del call, póngase de acuerdo. O mejor, háganse ver",4403,462
Tue Oct 29 16:58:32 +0000 2019,jlespert,"Hoy ya me llego varias veces este WS que es totalmente falso. Jamás escribiría semejante estupidez. Cortala @marquitospena Ustedes fueron un intrascendente tránsito entre dos gobiernos kirchneristas. Así de tristes los recordaremos la gente común, con los pies sobre la tierra https://t.co/FiPG2QLO69",3838,788
Sun Oct 27 23:35:48 +0000 2019,jlespert,Junto a @LuisRosalesArg #Elecciones https://t.co/d2Lz48jXME,1270,216
Sun Oct 27 21:48:56 +0000 2019,jlespert,Habla @luisrosalesARG del @FrenteDespertar #EleccionesArgentina2019 https://t.co/4jIkcuWNao,314,46
Sun Oct 27 21:44:00 +0000 2019,jlespert,https://t.co/rQDxWpDEzL,709,71
Sun Oct 27 14:11:39 +0000 2019,jlespert,Sospechosa falta de nuestras boletas en algunas escuelas de la Provincia de Tucumán https://t.co/8ReoAmg8n6,5201,857
Sun Oct 27 13:38:56 +0000 2019,jlespert,https://t.co/j0zdz0DNl6,698,189
Sun Oct 27 00:01:43 +0000 2019,jlespert,Empezaron sobrándonos con que eran el mejor equipo en 50 años y terminaron rezando a la virgencita de Portugal. Bendita soberbia,10153,1314
Sat Oct 26 19:50:45 +0000 2019,jlespert,"Gracias a todos los integrantes del @FrenteDespertar, al Partido Unite, a la UCede y a todos los chicos del @PLibertarioARG, el futuro es liberal y ya comenzó! https://t.co/zfmVRro9d0",4211,437
Fri Oct 25 20:24:21 +0000 2019,jlespert,Grave. Gracias @hrubini https://t.co/wgkJaVQARf,457,59
Fri Oct 25 19:48:38 +0000 2019,jlespert,https://t.co/oWM016YmH8,627,149
Fri Oct 25 02:03:39 +0000 2019,jlespert,Unos genios los chicos en la #EspertFest https://t.co/5vZHncdFS7,6375,834
Fri Oct 25 01:46:00 +0000 2019,jlespert,Siguen las selfies con @luisrosalesARG en la #EspertFest https://t.co/lKyQMqGZKx,238,10
Fri Oct 25 00:36:28 +0000 2019,jlespert,Selfie time Cierre de Campaña #EspertFest https://t.co/FF2zBUVC7H,400,15
Thu Oct 24 23:45:36 +0000 2019,jlespert,Cierre de Campaña #EspertFest https://t.co/Bxg9yF4FuH,817,143
Thu Oct 24 22:48:15 +0000 2019,jlespert,La #EspertFest está comenzando https://t.co/1ZjAPwLen1,1346,100
Thu Oct 24 19:10:24 +0000 2019,jlespert,https://t.co/sjsLwFXUyq,1257,109
Thu Oct 24 10:45:02 +0000 2019,jlespert,Gragea con algunas de mis afirmaciones en el Debate del 20-10 en Derecho en la UBA https://t.co/oC4JHKPDNo https://t.co/IdzFob4vTP,1294,239
Thu Oct 24 10:42:30 +0000 2019,jlespert,https://t.co/G0ihpkvUyu,302,45
Thu Oct 24 02:16:12 +0000 2019,jlespert,Video con mi entrevista en @adosvoces_tn con @BonelliOK y @AlfanoEdg por @todonoticias https://t.co/0j1GhAUzCH,125,16
Thu Oct 24 01:26:03 +0000 2019,jlespert,Video con mi participación junto a @luisrosalesARG en el programa @LaLupa26 de @paulinor76 por @canal26noticias   👇🏻 https://t.co/hiKrowU09D,161,16
Thu Oct 24 01:23:54 +0000 2019,jlespert,Video de mi participación completa esta tarde con Mauro Viale por @A24COM   👇🏻 https://t.co/1YGzdYtXuQ,138,13
Thu Oct 24 00:23:18 +0000 2019,jlespert,Ahora a las 22HS estaré en #ADosVoces junto a @BonelliOK y @AlfanoEdg por @todonoticias https://t.co/r79G3cvQyG,150,22
Thu Oct 24 00:14:56 +0000 2019,jlespert,https://t.co/A9antQs8tH,4088,955
Wed Oct 23 23:16:55 +0000 2019,jlespert,Ahora a las 21HS estaré junto @paulinor76 en su programa @LaLupa26 por @canal26noticias https://t.co/6qoor7KFqH,158,17
Wed Oct 23 22:17:38 +0000 2019,jlespert,Aca está el videito https://t.co/M1xomP9FKu https://t.co/iQecxZ2sKu,6728,1361
Wed Oct 23 20:52:51 +0000 2019,jlespert,"Acá junto a @luisrosalesARG reunidos con Jovina Luna, hermana del soldado Hermindo Luna, héroe abatido por Montoneros en Formosa en 1975. Hay que juzgar también a los terroristas para cerrar definitivamente la tragedia de los 70 https://t.co/qUYp2hoN7E https://t.co/9rt7SkmsBi",1122,209
Wed Oct 23 13:54:21 +0000 2019,jlespert,"Audio de mi entrevista con Jorge ""Petete"" Martínez por @radiomitrecba   👇 https://t.co/Qe1eQlKxdQ",85,11
Wed Oct 23 12:26:15 +0000 2019,jlespert,Hoy a las 18:00HS estaré con Mauro Viale en @A24COM https://t.co/GBospLOE0Y,218,19
Wed Oct 23 10:11:31 +0000 2019,jlespert,"La gente de trabajo, de esfuerzo, a la que revientan con impuestos para que la UNLP tenga plata para gastar, feliz ¿no? https://t.co/eWIOlVZ8tO",3454,850
Wed Oct 23 10:07:47 +0000 2019,jlespert,Y a mí me impacta tu velocidad para darte vuelta. Garrochaman https://t.co/zyIneGpaHd,16516,2772
Tue Oct 22 22:19:41 +0000 2019,jlespert,Ahora en la sede de la UCEDE Rosario con @luisrosalesARG @mansilladesouza https://t.co/ZWp1HdnSe5,466,43
Tue Oct 22 17:49:34 +0000 2019,jlespert,Mi pregunta (y su respuesta) a Alberto Fernández sobre la corrupción en el #DebatePresidencial2019 https://t.co/knH6UKpCCC,7251,1719
Tue Oct 22 17:26:41 +0000 2019,jlespert,Gracias Sica por tardar menos de 48 horas en darme la razón de lo que dije en el debate...son parecidísimos. La grieta es una gran mentira https://t.co/H1MzxafSdL,1977,371
Tue Oct 22 16:12:13 +0000 2019,jlespert,El Futuro es Liberal y ya Comenzo.  Te espero este Jueves 24 para nuestro cierre de campaña!  Están todos invitados para celebrar junto a nosotros  Inscripción: https://t.co/6xBXnwUFQB https://t.co/OWVgf4O1KS,1923,227
Tue Oct 22 00:30:57 +0000 2019,jlespert,Mañana te espero en Rosario! https://t.co/YlFIiZZ1fH,698,56
Mon Oct 21 21:52:32 +0000 2019,jlespert,Video de mi participación este mediodia con @maximmontenegro por @A24COM   👇🏻 https://t.co/fnBAoe9Wxv,200,24
Mon Oct 21 21:50:35 +0000 2019,jlespert,Audio de mi entrevista con @davellaneda77 y @LuisGasulla para el programa @LibermanOnLine por radio FM @Late931Oficial   👇🏻 https://t.co/v9Zih0OEuE,94,11
Mon Oct 21 21:45:42 +0000 2019,jlespert,Audio de la entrevista que me hiciera @PabloWende esta mañana por @fmmilenium   👇🏻  https://t.co/5CsLbUwyjU,126,16
Mon Oct 21 15:55:49 +0000 2019,jlespert,A las 14HS estaré con @maximmontenegro en su programa #MaxiAlMediodia por @A24COM https://t.co/DKCGNKRbb4,170,15
Mon Oct 21 02:23:39 +0000 2019,jlespert,"""Argentina tiene un gran futuro, ese futuro es liberal y ya comenzó"" #DebateAr19 https://t.co/7t0La4DHDP",10783,2310
Mon Oct 21 01:59:27 +0000 2019,jlespert,"""Mis queridos amigos ahora cerramos, cerramos con toda la fuerza liberal"" #DebateAr2019 https://t.co/TrcQdfHvqI",4771,439
Mon Oct 21 01:46:46 +0000 2019,jlespert,"""Para elminar los planes sociales, más allá de los mal dados, hay que generar crecimiento sostenido y usar el dinero de los planes sociales para financiar la capacitación de las personas que van a ser contratadas en el sector privado"" #DebateAr2019 https://t.co/oBWFWI7Gon",3568,594
Mon Oct 21 01:39:55 +0000 2019,jlespert,"""Hay que decir la verdad aunque cueste votos"" #DebateAr2019 https://t.co/fA73OxmPy5",5858,1028
Mon Oct 21 01:26:46 +0000 2019,jlespert,"""La verdad que viendo como se tiran misiles entre el Presidente @mauriciomacri y @alferdez me da un poco de gracia, muchachos abracense, tan diferente no son"" #DebateAr2019 https://t.co/MwqeWEw0iB",9637,2149
Mon Oct 21 01:20:48 +0000 2019,jlespert,"#FederalismoFiscal ""Eliminar la coparticipación no es eliminar personas, hasta podríamos eliminar el IVA"" #DebateAr2019",1551,235
Mon Oct 21 01:17:09 +0000 2019,jlespert,"""La coparticipación promueve la gestión irresponsable del gasto público y como consecuencia de que nadie paga las consecuencias de aumentarlo, hay muchas provincias que son feudos, nosotros vamos a eliminar la coparticipación"" #DebateAr2019 https://t.co/4BBGruBF5Q",1542,326
Mon Oct 21 00:57:13 +0000 2019,jlespert,"""A la luz de los procesamientos, le tengo una pregunta Alberto Fernández: usted no vio nada durante su gestión?"" #DebateAr2019 https://t.co/djBFRmywI3",32647,7915
Mon Oct 21 00:48:18 +0000 2019,jlespert,"""Tenemos que tener democracia sindical, 4 años de elección"" #DebateAr2019 #EspertDebate",2367,369
Mon Oct 21 00:41:48 +0000 2019,jlespert,"""Los impuestos al trabajo que hay en la Argentina los más altos del mundo"" #DebateAr2019 https://t.co/5gIG0ZJMx0",1938,407
Mon Oct 21 00:30:23 +0000 2019,jlespert,"""Para proveer seguridad más y mejores cárceles y más y mejores tribunales"" #DebateAr2019",1091,163
Mon Oct 21 00:27:40 +0000 2019,jlespert,"""Piquetero que corta la calle o ruta piquetero que va preso, cuidado Grabois contigo"" https://t.co/QFv7jNQspZ",25668,4901
Mon Oct 21 00:23:04 +0000 2019,jlespert,"""Vamos a bajar la edad de imputabilidad a los 14 años, delito de adulto,pena de adulto"" #DebateAr2019 https://t.co/1LpWrSgezx",6526,1042
Mon Oct 21 00:16:07 +0000 2019,jlespert,"""Mis competidores son parte de este sistema que destruye a la gente, yo voy a desenmascarar este sistema durante este segundo debate en Buenos Aires""  #DebateAr2019 https://t.co/DdzceonhNJ",1366,225
Sun Oct 20 23:18:34 +0000 2019,jlespert,Llegando al #DebateAr2019 https://t.co/vcOYxvF7Rp,1706,102
Fri Oct 18 20:52:34 +0000 2019,jlespert,"No diga estupideces señora. Los déficits se financian con emisión, deuda (Macri) y/o Reservas del Banco Central. Uds. en 2015 nos dejaron un BCRA sin Reservas líquidas. Así se financiaron Uds. mientras se pavoneaban ridículos con el default de la deuda https://t.co/vmE90lqg9B",20506,5958
Fri Oct 18 18:23:24 +0000 2019,jlespert,"De tanto insistir, al final la UIA obtuvo su cucarda https://t.co/5H9YpyxHyt",184,39
Fri Oct 18 10:27:22 +0000 2019,jlespert,Los lujos hay que dárselos en vida y nosotros nos lo dimos. El comentarista más caro de la histroria https://t.co/kKwqTMULzh,2010,314
Thu Oct 17 19:04:34 +0000 2019,jlespert,"Como dije en el #DebatePresidencial en Santa Fe, Argentina tiene que hacer todos los esfuerzos necesarios para que el asesino de Maduro sea apartado del poder en Venezuela https://t.co/bRhaWJg9HE",4496,931
Thu Oct 17 09:09:17 +0000 2019,jlespert,"Caraduras. Los mismos que hicieron de la grieta (que, además, es falsa) EL dispositivo para ganar elecciones gobernando pésimo, ahora te dicen que no va más. Pidan disculpas por lo menos https://t.co/Yial5uhMNn",1263,195
Wed Oct 16 20:09:27 +0000 2019,jlespert,El domingo a segundos de entrar al escenario para el #DebatePresidencial https://t.co/ItSEIvZ3S4,914,49
Wed Oct 16 16:46:08 +0000 2019,jlespert,Papá Noel llegó un par de meses antes de Navidad https://t.co/u8BVX0PZua,2258,251
Wed Oct 16 10:58:04 +0000 2019,jlespert,"Si no es inflación, es deuda o impuestazos. Lo que la vieja política no te negocia son sus privilegios y clientes, o sea, el gasto público no se toca. Así nos va https://t.co/zGIa8NLmk0",1950,345
Wed Oct 16 08:48:30 +0000 2019,jlespert,Que manera de decir estupideces la Cristi. O sea que la libertad nos transforma en delincuentes o monos drogados que generamos crisis económicas https://t.co/I0Sd8JXddJ,19320,3788
Wed Oct 16 01:27:50 +0000 2019,jlespert,Mi mas sentido pésame a familiares y amigos https://t.co/wG6FTj4kvl,695,28
Tue Oct 15 02:52:13 +0000 2019,jlespert,Video de mi participación hace instantes en @Intratables con @fabdoman por @AmericaTV   👇 https://t.co/eDrjEe9c6F,309,36
Tue Oct 15 01:09:43 +0000 2019,jlespert,En la previa de @Intratables cenando con los cracks de @jimeargentina y @luisrosalesARG https://t.co/P8ThOvrG6o,544,20
Tue Oct 15 00:07:55 +0000 2019,jlespert,Video de mi participación esta tarde en el programa de @Julyweich Noticia y 1/2 por @lanacionmas   👇🏻 https://t.co/alymxxZBTI,197,28
Mon Oct 14 22:54:52 +0000 2019,jlespert,Una vergüenza https://t.co/yQvIjdZloa,7318,1581
Mon Oct 14 22:52:56 +0000 2019,jlespert,Pelea de alta relevancia https://t.co/Sxe9KNRN6W,2487,210
Mon Oct 14 20:47:03 +0000 2019,jlespert,Esta noche a las 22:30hs estaré con @fabdoman en @Intratables por @AmericaTV https://t.co/hk5Y0ig6Ra,535,64
Mon Oct 14 13:24:44 +0000 2019,jlespert,En camino al 2do debate presidencial (20-10). Con @luisrosalesARG Foto @ladivagante https://t.co/IMAKF4a8oF,1690,90
Mon Oct 14 02:43:23 +0000 2019,jlespert,"""La gente votó una falsa grieta, entre cambiemos y el kirchnerismo, la cantidad de medidas económicas que han tomado son muy similares a ambos, el gobierno de cambiemos no pudo evitar que volviera el kirchnerismo. Estoy convencido que nosotros si lo podemos hacer"" #DebateArg2019 https://t.co/1TPHo4DEq0",3782,657
Mon Oct 14 02:01:14 +0000 2019,jlespert,Se acerca el final del #DebateAr2019 https://t.co/5GN8OW4Veh,1885,152
Mon Oct 14 01:55:12 +0000 2019,jlespert,Sobre La Educación #DebateArg2019 https://t.co/RPetXJxlXa,3648,739
Mon Oct 14 01:00:46 +0000 2019,jlespert,"""El candidato @alferdez dijo que es necesario un shock de consumo, y más exportaciones, las dos cosas al mismo tiempo no se puede, se podrá aumentar el consumo, si previamente las exportaciones han crecido mucho y vamos a tener que comerciar con todo el mundo"" #DebateAr2019",3978,837
Mon Oct 14 00:51:37 +0000 2019,jlespert,"""No engañemos a los jubilados, para que el sistema jubilatorio de hoy pueda pagar el 82% móvil tiene que haber 4 trabajadores activos por cada jubilado, tenemos la mitad, no le mintamos a nuestros pobres abuelos que este sistema es sustentable"" #DebateAr2019 https://t.co/qIciRZeFTH",3149,700
Mon Oct 14 00:47:57 +0000 2019,jlespert,"""Argentina tiene un sistema que destruye a la gente que vive adentro del país. Los ganadores son parte del problema de nuestra decadencia:  empresarios prebendarios, los sindicalistas y políticos que ni siquiera pueden leer un discurso en el Congreso"" #DebateAr2019",2323,568
Mon Oct 14 00:42:23 +0000 2019,jlespert,"""Basta Moyano de currar con la justicia social"" #DebateAr2019 https://t.co/IlRsBspgDL",7295,1481
Mon Oct 14 00:29:52 +0000 2019,jlespert,"""Si no queremos pagar la deuda, dejemos de vivir como mangueros del mundo y ganemos los dolares para el crecimiento con el comercio, que es la manera genuina de los países del mundo lo hacen para crecer""",3745,733
Mon Oct 14 00:21:04 +0000 2019,jlespert,"""Yo un ciudadano común como vos, voy a competir con un Presidente, un ex Jefe de Gabinete, un ex Vicepresidente del Bco Nación, un candidato eterno y un ex Min. de Economía, vamos a defender las ideas de la libertad , Argentina tiene futuro si hace algo completamente diferente"".",9257,1485
Sun Oct 13 23:22:44 +0000 2019,jlespert,Saludando a ⁦@mauriciomacri⁩ a minutos del #DebateAr2019 https://t.co/KsRuer9cz4,6808,870
Sun Oct 13 23:07:30 +0000 2019,jlespert,Ultimando detalles con @ClaudioMartne17 Productor General del #DebateAr2019 https://t.co/oiaojhHmmh,232,22
Sun Oct 13 23:03:42 +0000 2019,jlespert,Llegando al #DebateAr2019 https://t.co/b8JgITxivI,918,72
Sun Oct 13 01:42:43 +0000 2019,jlespert,Video de la entrevista esta tarde para #AmericaNoticias con @edubattaglia y @pautrapani por @AmericaTV   👇 https://t.co/YByePldiMA,93,14
Sun Oct 13 00:32:04 +0000 2019,jlespert,Cena con el equipo en Santa Fé https://t.co/QWXnnwo1J4,525,31
Sat Oct 12 14:58:18 +0000 2019,jlespert,Basuras https://t.co/x8skAUWFlI,232,32
Fri Oct 11 13:03:58 +0000 2019,jlespert,Bienvenidos a la Argentina socialista! https://t.co/WW6ILhwYqs,5027,1369
Thu Oct 10 23:04:05 +0000 2019,jlespert,Combitweet https://t.co/5iMv4fNHS0,535,75
Thu Oct 10 20:43:29 +0000 2019,jlespert,"Si vuelven, armemos desde hoy la mejor oposición al kirchnerismo https://t.co/NNqe4q7amb",1285,228
Thu Oct 10 19:37:03 +0000 2019,jlespert,Esta gente quiere la Argentina socialista. Estan mal de la cabeza https://t.co/9hiLJXOBN5,2630,595
Wed Oct 09 21:59:10 +0000 2019,jlespert,Cada vez más ridículo https://t.co/VvT1iI1QUg,2602,428
Wed Oct 09 21:23:02 +0000 2019,jlespert,"Argentina debe ""detonar"" lo que hizo en últimos 50 años para... https://t.co/2EHAhOBlqZ",253,54
Tue Oct 08 17:02:15 +0000 2019,jlespert,"Italia achica el Congreso: para ahorrar, eliminó 230 diputados y 115 senadores https://t.co/V0QgJAqRfh vía @Ambitocom",4846,1571
