Wed Jun 12 12:20:47 +0000 2019,jlespert,"Impresionante tweet. Por eso escribi ""La Sociedad Complice"" https://t.co/ILSxnxOTKz",965,207
Wed Jun 12 10:36:18 +0000 2019,jlespert,"La SRA sobre Pichetto (Pag 7 Clarin), un tipo que en 2008 defendió a muerte en el Congreso la 125 que iba a fundir al campo. La Sociedad Complice https://t.co/hEhboUJuix",878,198
Wed Jun 12 00:37:41 +0000 2019,jlespert,Formula Mauri-Miguel Angel. El kirchnerismo de buenos modales ya es ley,3475,627
Tue Jun 11 23:35:32 +0000 2019,jlespert,"Día histórico para las ideas de la libertad. Conformamos el Frente DESPERTAR junto al Presidente de la UCEDE, Gonzalo Mansilla de Souza y de UNIR, Alberto Asseff para las elecciones nacionales 2019 @mansilladesouza @DiputadoAsseff  @nazaetchepare @gdiazcordoba @FrenteDespertar https://t.co/DZHdifN9e5",1581,237
Tue Jun 11 22:30:45 +0000 2019,jlespert,"El Senadorisimo y ahora Vicecandidato Macrista, demostrando una plasticidad y ductilidad que deja a nuestro genial Julio Bocca mas duro que una piedra https://t.co/8a7ifyT5zC",1462,386
Tue Jun 11 20:58:11 +0000 2019,jlespert,"Picheto Vice de Macri y Massa junto con CK, demuestran la promiscuidad, lo cínico e hipócitas que son todos estos politicos profesionales. Constituyen una corporación infame que se vive burlando y estafando a la gente ¿Cambiar al país decadente que somos? Jamas",10800,3540
Tue Jun 11 20:53:21 +0000 2019,jlespert,"""No vuelven mas"" https://t.co/IK1vW9GmC9",2150,450
Tue Jun 11 19:14:47 +0000 2019,jlespert,"Ahi tenes al kirchnerismo de paladar negro más Garrocha Massarasa y a la derecha el kirchnerismo de buenos modales, tal como te lo dije siempre ¿Y ahora? Más que nunca @FrenteDespertar! https://t.co/5W5UdciCA8",2965,838
Tue Jun 11 15:44:53 +0000 2019,jlespert,Video de mi charla de esta mañana temprano con @SpanishLiberty https://t.co/ocdMmRoT4p,219,44
Tue Jun 11 10:15:00 +0000 2019,jlespert,Tierno https://t.co/9K9zoexVTf,3422,454
Tue Jun 11 10:07:44 +0000 2019,jlespert,"Claro, hace falta una nueva estatua de Perón para terminar con 70 años de peronismo, no? 🤦‍♂️ https://t.co/P42Qid6MjG https://t.co/HNH9ZCz5Wz",1528,367
Tue Jun 11 03:01:59 +0000 2019,jlespert,Video con mi participación en #LunesIntratable @Intratables con @fabdoman por @AmericaTV el 10 de junio de 2019 https://t.co/0qWopOB3dj,300,44
Mon Jun 10 22:47:01 +0000 2019,jlespert,"Ya estamos 4tos con 8% de intención de voto, pisándole los talones al PJ Alt que tiene 10%. Vamos @FrenteDespertar! https://t.co/rZY2Qmzgzv",4444,904
Mon Jun 10 21:17:32 +0000 2019,jlespert,Hoy lunes 10/06 a las 22:00hs estaré en @Intratables por @AmericaTV https://t.co/7SiEn8CpOx,673,149
Mon Jun 10 20:40:27 +0000 2019,jlespert,Audio de mi diálogo esta mañana con @RubenDGomez por @radiohalley   👇🏼 https://t.co/vslOxVfQ1T,107,22
Mon Jun 10 17:33:54 +0000 2019,jlespert,"A este delirio nos ha llevado la misma clase politica que hoy, de nuevo, se presenta como solución a tus problemas en las elecciones 2019 https://t.co/Nnz3GD1tmz",1084,310
Mon Jun 10 14:21:51 +0000 2019,jlespert,Siempre dicen esto cuando el sector privado no da mas y boquea. Que cínicos que son https://t.co/navbmXRtOA,2104,376
Mon Jun 10 01:50:37 +0000 2019,jlespert,Felicitaciones @fantinofantino por tu #MartinFierro2019 por la conducción en @animalesoficial por @AmericaTV Única tu generosidad para conmigo en tu programa,809,59
Sun Jun 09 22:45:08 +0000 2019,jlespert,Ame https://t.co/dHzAMWzZUH,3090,573
Sun Jun 09 21:26:28 +0000 2019,jlespert,"En mi querida Pergamino, no pasó la langosta. Fue el mejor equipo en 50 años https://t.co/1QjCxEmdKD",600,122
Sun Jun 09 21:19:25 +0000 2019,jlespert,El mejor equipo en 50 años...nos van a fundir a todos https://t.co/ghTatMVcTe,843,201
Sun Jun 09 21:18:34 +0000 2019,jlespert,"Clavos, no claves 🤣 https://t.co/zWtO9KrR48",728,73
Sun Jun 09 16:34:47 +0000 2019,jlespert,Menos que habrá debate presidencial. Tanto Albertico como la Cristi me tienen bloqueados y me pierdo de jugosos intercambios por aquí https://t.co/aZ9D2jcjOi,9447,1802
Sun Jun 09 16:25:59 +0000 2019,jlespert,Gracias mis queridos! A seguir trabajando juntos para cortar con la decadencia e invitarnos a soñar con un país razonable https://t.co/d3vl5FoadH,717,119
Sun Jun 09 12:18:23 +0000 2019,jlespert,"Que este conjunto de dementes puedan volver a gobernar, hace de nosotros ""La Sociedad Complice"". Hicieron todo mal motivo por el cual tendremos que pagar más impuestos todavía. Presos los quiero. A todos. Arruinaron más todavía a nuestro país https://t.co/qoyNp9tx5c",4867,1794
Sat Jun 08 22:35:17 +0000 2019,jlespert,"No hay un sola línea en este doc de Massarasa donde haya una definición concreta, precisa de algo para enfrentar lo difícil, duro y hasta frustrante a veces que es vivir en Argentina para la gente de trabajo, de esfuerzo, de estudio https://t.co/FpfEAlIIqF",1371,323
Sat Jun 08 12:38:09 +0000 2019,jlespert,"Hay que eliminar la coparticipacion de impuestos. Si estos tipos tuvieran que pagar el costo político de subir impuestos locales para hacer esto, no lo harían; la gente de trabajo se los comería crudos. Plata que viene de arriba, sin esfuerzo, se malgasta https://t.co/yLxYGQCt7L",1816,555
Sat Jun 08 03:56:27 +0000 2019,jlespert,Video con mi participación recién en #AnimalesSueltos @animalesoficial de @fantinofantino por @AmericaTV https://t.co/J9NIqkV4wi,429,91
Sat Jun 08 03:49:47 +0000 2019,jlespert,"Sergio Massarasa, nuestro tierno Papá Noel https://t.co/ZrN5jDqMbP",4039,949
Fri Jun 07 22:18:50 +0000 2019,jlespert,Hoy Viernes 07/06 a las 23:00hs estaré en @animalesoficial con @fantinofantino por @AmericaTV https://t.co/irpfXfWnpE,601,119
Fri Jun 07 16:26:25 +0000 2019,jlespert,Sigan pariticipando muchachos https://t.co/TWr2P8Fx50,1162,184
Fri Jun 07 14:32:23 +0000 2019,jlespert,"José Luis Espert: ""La gente está podrida de pagar impuestos para mantener vagos"" - Infobae https://t.co/kENCqrTmw5",3616,829
Fri Jun 07 14:28:31 +0000 2019,jlespert,Saludo a todos los periodistas en su día. El rol del periodismo independiente es imprescindible en una democracia republicana. Nos cuentan la verdad aunque le duela al poder de turno,929,119
Fri Jun 07 04:38:10 +0000 2019,jlespert,"Video de mi participación en el programa ""Sensación Térmica"" de @edufeiok por @CanalMetro  👇🏻 https://t.co/GoBMOqSi53",292,56
Thu Jun 06 20:34:32 +0000 2019,jlespert,"La verdadera grieta es entre personajes nefastos como éste, miembro de la vieja política que ha destruido el país y nosotros, la gente de a pie, la de trabajo, la que estudia, la de mérito, la que se esfuerza https://t.co/9sW0Wchebz",4353,994
Thu Jun 06 20:11:57 +0000 2019,jlespert,"Hoy Jueves 06 de Junio a las 22:30hs estaré con Eduardo Feinmann @edufeiok en su programa ""Sensación Térmica"" por canal @CanalMetro",415,69
Thu Jun 06 20:02:48 +0000 2019,jlespert,Gracias @PerfilEscuela Los espero chicos! https://t.co/NLwyny7mrV,295,44
Thu Jun 06 16:46:04 +0000 2019,jlespert,#BajenLosImpuestos https://t.co/UhilfCDkRc,1858,330
Thu Jun 06 14:44:39 +0000 2019,jlespert,¿Por qué es importante abrir la economía al comercio y abandonar el mito de la sustitución de importaciones? https://t.co/4C8JsGCfAI,2393,703
Thu Jun 06 13:51:03 +0000 2019,jlespert,"Esto es culpa, entre otras cosas, del triangulo maldito de la sustitución de importaciones, el Estado Presente y las leyes sindicales importadas de La Carta del Lavoro. Hay que hacer todo al revés. Apertura al comercio, Estado razonable y leyes laborales amigables con el empleo https://t.co/lEhvbtI7rm",2689,714
Thu Jun 06 12:54:01 +0000 2019,jlespert,"A  75 años del histórico desembarco en Normandia, el eterno agradecimiento a los miles de soldados que liberaron a Europa del nazismo y que el legado de libertad sea ejemplo inclaudicable para las futuras generaciones",2880,420
Thu Jun 06 11:02:16 +0000 2019,jlespert,"Alberto Fernández le dijo recien a @luisnovaresio en @radiolared ""no creo en los debates (presidenciales)"" ¿Será que no debatirá? Sería lamentable",2671,476
Thu Jun 06 10:58:06 +0000 2019,jlespert,"Cristina (Presidente), Massa (Jefe de Gabinete), Boudou (Director del Anses) deberían estar presos por mala praxis por haberle robado (lo que tenían en una AFJP) lo ahorrado por 15 años a millones de personas que un año antes les dijeron que no querían una jubilación estatal https://t.co/7LHuZEAbW0",2818,1009
Thu Jun 06 10:20:07 +0000 2019,jlespert,El futuro es liberal https://t.co/E8fHp9Qrx3,5044,1393
Thu Jun 06 04:39:16 +0000 2019,jlespert,Video de mi entrevista con @luisnovaresio por @A24COM  👇🏻 https://t.co/2sDWy2KTq5,560,160
Wed Jun 05 20:38:11 +0000 2019,jlespert,Esta noche 23:50 hs estaré con @luisnovaresio por @A24COM https://t.co/kcOMFWcUw8,738,159
Wed Jun 05 14:03:28 +0000 2019,jlespert,Con las alumnas de la @UCEMA_edu https://t.co/pa3dP6ENvZ,775,70
Tue Jun 04 21:45:13 +0000 2019,jlespert,Hoy nos reunimos en la sede del @FrenteDespertar con @Danilema_dl @madorni @hrubini @eli_scialabba @Miguel_Boggiano @aetchebarne @fspotorno https://t.co/QG4a6e5Fh8,1190,171
Tue Jun 04 17:12:54 +0000 2019,jlespert,Audio de mi diálogo con @MauroVialesA24 para @La990Radio   ⬇️ https://t.co/HdPUfif4zv,139,30
Tue Jun 04 15:28:14 +0000 2019,jlespert,Audio de mi diálogo esta mañana con @maurofederico por @delta903fm   ⬇️ https://t.co/usSFkLhpNl,107,22
Mon Jun 03 21:22:42 +0000 2019,jlespert,Genias! https://t.co/Y7wdjEsZut,311,30
Mon Jun 03 10:53:24 +0000 2019,jlespert,Sacale la obra social al papito y el crucero mas lujoso que se pagaria seria en un barquito de madera de balsa navegando en una pelopincho https://t.co/Nofa6IWZPl,5497,1350
Mon Jun 03 02:47:02 +0000 2019,jlespert,"Felicitaciones chicos del @PLibertarioCABA en su primer aniversario. Gracias por la invitación, su constante trabajo en defensa de las ideas de la libertad y el video. Excelente evento! https://t.co/XkdTB9Ob2K",833,97
Sun Jun 02 20:54:09 +0000 2019,jlespert,Como no amar al autito ploteado con el @FrenteDespertar Vamoooo! https://t.co/ZQvpmT0m1k,2513,273
Sun Jun 02 16:40:18 +0000 2019,jlespert,Ahora en el Autodromo!!  @FrenteDespertar https://t.co/u5AJnOaPPx,674,82
Sun Jun 02 15:33:08 +0000 2019,jlespert,Crack! https://t.co/zKKyrwFejJ,3398,617
Sun Jun 02 03:46:28 +0000 2019,jlespert,Video con la segunda parte de mi recorrido por el Barrio 31 de CABA  👇🏻 https://t.co/MSmMjuSOar,184,35
Sun Jun 02 03:45:36 +0000 2019,jlespert,Video con la primera parte de mi recorrido por el Barrio 31 de CABA  👇🏻 https://t.co/QXrDQyKu1F,130,19
Sun Jun 02 00:39:31 +0000 2019,jlespert,En vivo seguimos recorriendo el Barrio 31  👇🏻 https://t.co/MSmMjuSOar,165,23
Sun Jun 02 00:25:04 +0000 2019,jlespert,Ahora en el Barrio 31 todo listo para la #EspertFest31 #FrenteDespertar https://t.co/nmGU4qewFO,440,66
Sat Jun 01 23:26:46 +0000 2019,jlespert,Ahora en vivo desde el Barrio 31 todo listo para la #EspertFest31 👇🏻  https://t.co/QXrDQyKu1F,148,35
Sat Jun 01 22:38:05 +0000 2019,jlespert,En minutos en vivo estaré en el Barrio 31 de la ciudad de Buenos Aires. https://t.co/hnvApr3nB1,639,58
Sat Jun 01 18:26:13 +0000 2019,jlespert,Sobrevivió a todos y todas pero no pudo con el rayo fulminante de Ojitos Celestes https://t.co/k499aDemvV,2630,690
Sat Jun 01 16:18:36 +0000 2019,jlespert,Video de mi entrevista para el Noticiero Trece  @mediosprovincia de La Rioja 31/05/19 #Despertar #Espert2019 https://t.co/4G4aDpN5Pt,180,43
Sat Jun 01 16:03:49 +0000 2019,jlespert,Conferencia de prensa @jlespert en el piso - NoticieroTrece  @mediosprovincia - La Rioja - 31/05/19 #Despertar #Espert2019 https://t.co/bKV1gfw9Xz,198,44
Sat Jun 01 15:20:24 +0000 2019,jlespert,"A. Fernandez era Jefe de Gabinete cdo se estatizó Aerolíneas de brutal manera (bien a lo K). Ahora la gente de a pie, la gente que supuestamente él defenderá desde un eventual gobierno suyo, es la que tendrá que pagar el millonario juicio perdido. Inútil https://t.co/ZbJeOW0M3R",2049,729
Sat Jun 01 03:08:39 +0000 2019,jlespert,.@ABENEGASLYNCH_h https://t.co/f2nMBgk1om,369,58
Sat Jun 01 00:20:26 +0000 2019,jlespert,Presentación del libro #LaSociedadCómplice en el Club Social La Rioja. Gracias La Rioja!  #FrenteDespertar #Espert2019 https://t.co/zfL7jqVTq3,330,47
Fri May 31 16:46:43 +0000 2019,jlespert,Vine para contribuir a la unión de todos en La Rioja. Esta transformación se expande en todo el pais. #espert2019 #FrenteDespertar https://t.co/6l1PkhwS1V,968,131
Fri May 31 15:07:03 +0000 2019,jlespert,Todos los responsables de este desastre deberian estar presos por mala praxis. La sociedad lo pagará con mas impuestos y/o crisis. Se tiene que terminar esto de que desde el poder experimenten con nosotros como conejitos de indias https://t.co/6fwgsP1Eab,2447,886
Fri May 31 12:06:59 +0000 2019,jlespert,Con la casa de la independencia de fondo nos despedimos. Gracias Tucumán por el cariño y la calidez. #Espert2019 #FrenteDespertar https://t.co/8gQWtTzUeS,755,78
Fri May 31 12:01:38 +0000 2019,jlespert,"Ayer con el gran Victor Elias (UChicago) en Tucuman, profesor y maestro de muchos (me incluyo). Sigo aprendiendo de él. Genio https://t.co/L4YBBwqnVa",536,36
Fri May 31 01:59:24 +0000 2019,jlespert,Muchas Gracias! https://t.co/bZoStybKUP,394,45
Thu May 30 23:58:22 +0000 2019,jlespert,Ahora en vivo Conferencia en Tucumán desde Instagram 👇🏻  https://t.co/Ce5Y0BPfbr https://t.co/uqhRmT9V2N,229,37
Thu May 30 23:12:13 +0000 2019,jlespert,Todo listo para la presentación del libro #LaSociedadCómplice en Tucumán! https://t.co/lLNu2Egnu1,763,113
Thu May 30 18:14:00 +0000 2019,jlespert,Esta tarde 19:00 hs los espero para la presentación del libro #LaSociedadCómplice en San Miguel de Tucumán! https://t.co/eaOM2bI5lm,305,52
Wed May 29 19:17:55 +0000 2019,jlespert,Los sindicalistas y yo https://t.co/ddicW12T4s,3103,814
Wed May 29 14:03:06 +0000 2019,jlespert,"Saludo a los miembros del Ejército Argentino en su día. Les auguro un futuro de compromiso y valiosos servicios al país. Los necesitamos para progresar y los reconocemos por su abnegada labor: ayudando en catástrofes, apoyando la política exterior y asegurando la paz. Adelante!",2936,467
Wed May 29 02:34:09 +0000 2019,jlespert,Entrevista completa con @josedel_rio en @lanacionmas   🔽 https://t.co/TonrWXEGlk,171,26
Wed May 29 01:59:32 +0000 2019,jlespert,Desde el piso en vivo en @lanaciónmas desde Facebook 👇🏻  https://t.co/8Rffz7GBhK,134,20
Wed May 29 01:52:35 +0000 2019,jlespert,EN VIVO - LaNación+ 🔽 https://t.co/wDQGJvmK2q https://t.co/IatxGo4jlq,274,43
Wed May 29 00:47:10 +0000 2019,jlespert,Amo a Rama https://t.co/4Jfp3YFJkP,538,33
Tue May 28 16:41:08 +0000 2019,jlespert,Hoy a las 22:00 estare con @josedel_rio en #MesaChica por @lanacionmas,344,68
Tue May 28 08:51:38 +0000 2019,jlespert,El viernes en La Rioja! https://t.co/apoLbfencx,350,53
Mon May 27 12:15:02 +0000 2019,jlespert,"Retenciones a las exportaciones y aranceles a la importación, los 2 impuestos más cavernícolas y retrógrados que hay. Los 1ros a eliminar en un gobierno que pretenda cortar con nuestra decadencia https://t.co/RqGP3Hvinx",2003,482
Mon May 27 10:27:16 +0000 2019,jlespert,Este jueves en San Miguel de Tucuman! https://t.co/vAXChb9SJ6,470,88
Mon May 27 09:04:13 +0000 2019,jlespert,Conferencia de prensa previa a la presentación de #LaSociedadCómplice en Posadas Misiones con @noticiasdel6 @misionesonIine @tv12misiones y otros  🔽 https://t.co/Rt40pBAFTX,128,21
Mon May 27 00:53:13 +0000 2019,jlespert,Video con el resumen de la sección de preguntas de mi Conferencia de #LaSociedadCómplice en la ciudad de Posadas provincia de Misiones  🔽 https://t.co/wfh9jlBoa4,227,49
Mon May 27 00:51:38 +0000 2019,jlespert,Video con un resumen de mi Conferencia de #LaSociedadCómplice en la ciudad de Posadas  🔽 https://t.co/ks7GOrW2Pj,150,31
Sun May 26 22:55:13 +0000 2019,jlespert,Apoyemos a este brillante joven y mejor persona. Yo ya lo hice ¿y vos? https://t.co/2vQxbPvrps,610,195
Sun May 26 20:38:33 +0000 2019,jlespert,No es cierto Sr. Kandidato. En 2003 Ud. la tuvo regalada. Duhalde fue el Nerón argentino. Prendió todo fuego y la lluvia de dólares de la soja les dejó a uds. el camino lleno de oro. Hoy sí que Macri agravó el desastre que dejó tu Vice https://t.co/bKkYWIouk8,3071,798
Sun May 26 20:31:03 +0000 2019,jlespert,Video de mi entrevista con Pablo García y @yoalefarias para @misionescuatro   🔽 https://t.co/8fUJCnflh4,113,13
Sun May 26 18:32:34 +0000 2019,jlespert,Video de mi entrevista con @Gustavoperez01 por @misionesonIine   🔽 https://t.co/qToTHthQ0t,110,18
Sun May 26 17:45:58 +0000 2019,jlespert,Video de mi entrevista con @raquelukowiec y @lopezinformes para @CanalCuatroPM  🔽 https://t.co/KfErWXHu0L,101,18
Sun May 26 17:03:09 +0000 2019,jlespert,Video de mi entrevista con @jorgekurrle y @emiliolattesn6 en @noticiasdel6 en la ciudad de Posadas 🔽 https://t.co/j1P3rIeWxs,139,27
Sun May 26 13:38:32 +0000 2019,jlespert,Excelente! https://t.co/TBLtMZQUX3,212,30
Sun May 26 10:49:51 +0000 2019,jlespert,Macri no se bajará de la candidatura https://t.co/0GH4bkvxFs,284,38
Sun May 26 00:48:42 +0000 2019,jlespert,"Váyanse a recontraca...Sáquense la careta y roben, sería mas honesto https://t.co/2vn5lUSywc",4907,1250
Sat May 25 18:32:55 +0000 2019,jlespert,"La pared sonriente de Peña, también  tiene poesía https://t.co/EP22nqt75j",424,46
Sat May 25 14:16:14 +0000 2019,jlespert,"Argentina nació con el libre comercio. La Revolución del #25DeMayo impulsada por Moreno y Belgrano fue, en esencia, de orden económico para romper el monopolio comercial español. Es tiempo de Despertar. Volvamos a las ideas de la libertad, q nos hicieron grandes @FrenteDespertar https://t.co/4KcKKzcyg5",3694,1156
Sat May 25 02:21:46 +0000 2019,jlespert,"Hoy presentamos ""La Sociedad Cómplice"" en Posadas. Gracias por el cariño y el entusiasmo para difundir las ideas de la libertad y el sentido común. El comienzo de un #Despertar https://t.co/iR248IxWFr",944,156
Fri May 24 17:02:10 +0000 2019,jlespert,"Elecciones 2019: Para Espert, “Macri es un fracaso absoluto” - https://t.co/b5vjJO9OOD",1012,195
Fri May 24 13:54:24 +0000 2019,jlespert,"Funciona sólo para destruir al país, a la gente de trabajo, a la que quiere progresar para que brutos como vos, Sapag, sigan jugando a la política. Tomatelas https://t.co/zpyg2hvLzO",2719,626
Fri May 24 10:29:48 +0000 2019,jlespert,La cita es hoy. Te espero! https://t.co/cjsDi0bTsn,653,114
Fri May 24 05:04:36 +0000 2019,jlespert,La #EspertFest con los jóvenes en el Club Social de Corrientes https://t.co/tggQOx7Bly,361,32
Fri May 24 04:44:44 +0000 2019,jlespert,Fotos del evento de la presentación del libro #LaSociedadCómplice en la Provincia de Corrientes https://t.co/mr7WX6M6Ui,502,82
Fri May 24 03:29:17 +0000 2019,jlespert,En la sede de la Federación Económica con Jóvenes del Partido Libertario y del Club De La Libertad de Corrientes https://t.co/arici8zdSA,655,82
Thu May 23 20:37:40 +0000 2019,jlespert,Hoy celebramos que las  ideas liberales y del sentido común tengan su primer local en la provincia que vio nacer al libertador San Martín. Vamos @FrenteDespertar ! https://t.co/BerCCNvpol,1878,287
Thu May 23 15:55:05 +0000 2019,jlespert,Hoy estaré en la ciudad de Corrientes. Te espero! https://t.co/7EvqjivFXi,489,71
Thu May 23 14:46:36 +0000 2019,jlespert,"Luego de 3 meses consecutivos de recuperación desestacionalizada (es sabido que contra 2018 estaremos mal), la economía volvió a caer en marzo. Todavía no se puede afirmar categóricamente que hayamos tocado un piso https://t.co/pIvJeMWrk7",491,89
Thu May 23 12:40:11 +0000 2019,jlespert,"Ayer en Resistencia Chaco nos reunimos con los hermanos originarios de la comunidad Qom de las 3 etnias Wichi, Toba, Moqoit. Seguimos despertando argentina @FrenteDespertar https://t.co/sJPgrIUqT9",770,130
Thu May 23 10:17:09 +0000 2019,jlespert,"Ayer presentando ""La Sociedad Cómplice"" impresionante respuesta de los jovenes chaqueños. Mientras el resto de los políticos se reúne y negocia cómo repartirse la torta, nosotros recorremos el país para ver cómo la agrandamos. Ya casi no queda más torta pero tenemos futuro! https://t.co/vTNmxKlQ9h",4234,837
Wed May 22 11:46:27 +0000 2019,jlespert,Grave https://t.co/MIUHb1vTep,1183,285
Wed May 22 11:11:30 +0000 2019,jlespert,"Es hoy en Resistencia, Chaco. Te esperamos! https://t.co/WSJfvKxwbD",362,45
Wed May 22 10:06:21 +0000 2019,jlespert,Entrevista que @brenstrum me hizo para @lanacion https://t.co/aSVK7Mo4cV,232,44
Wed May 22 02:52:25 +0000 2019,jlespert,Gracias Formosa por la cantidad inédita de jóvenes que se suman a las ideas de la libertad. Cada día somos más los que quieren Despertar. @FrenteDespertar https://t.co/fGAUaZCeyf,1102,135
Wed May 22 02:35:08 +0000 2019,jlespert,"Maximo, 12 añitos, fan mío y de las ideas de la libertad. Presente hoy con su papá en la presentación de #LaSociedadCómplice en Formosa. Lleno total https://t.co/pCCLEX9Uur https://t.co/l7826uYCuI",1964,150
Tue May 21 02:50:39 +0000 2019,jlespert,Video de mi participación hace instantes en @Intratables por @AmericaTV   🔽 https://t.co/HBXnv4Fznm,523,91
Mon May 20 22:49:55 +0000 2019,jlespert,José Luis Espert vendrá a Formosa a presentar su libro: Una sociedad cómplice https://t.co/qDGLQFXZrK,478,70
Mon May 20 19:16:20 +0000 2019,jlespert,Esta noche a las 22hs estaré en @Intratables por @AmericaTV #LunesIntratable https://t.co/NpHmyj4uln,758,140
Mon May 20 18:57:29 +0000 2019,jlespert,"Lavagna, A. Fernandez y Cambiemos. Todos populismos de distinto color. Los únicos que estamos de este lado de la grieta, lejos de la vieja política y del lado del que trabaja, se esfuerza, estudia y basa su éxito en el mérito somos el @FrenteDespertar  https://t.co/qgkD9pDjM8",3030,696
Mon May 20 17:01:20 +0000 2019,jlespert,José Luis Espert hace campaña con sus propias encuestas: ¿puede ser la sorpresa? - https://t.co/e9ljx6Oe2V,1630,311
Mon May 20 10:22:08 +0000 2019,jlespert,"Albertico no falla. Cada vez que merodea el poder, hay olor a default. Ya lo hizo con Néstor. Ahora, con buenos modales, amaga con lo mismo. Gracias Macri por tanto! https://t.co/A6fQ9203cL",1257,264
Mon May 20 00:38:14 +0000 2019,jlespert,"Que estos cavernícolas, impresentables K tengan pantalla de nuevo, es obra pura y exclusiva de un gobierno de ineptos y soberbios como el de Cambiemos. Gracias chicos! https://t.co/u2NlV6m8jz",3150,598
Sun May 19 16:47:12 +0000 2019,jlespert,Miren qué tesorito el candidato Albertico Fernández (cruce viejo con el muchacho) https://t.co/ldOhqhGX1g,7707,1977
Sun May 19 14:45:14 +0000 2019,jlespert,"De acuerdo. Maduro es una dictador, asesino, narcotraficante y desestabilizador de la región. Por las buenas no se irá https://t.co/6RZlNqOnyZ",3171,588
Sun May 19 11:23:43 +0000 2019,jlespert,Gran encuentro anoche querido Yamil! https://t.co/FGSfh3EOut,1432,109
Sun May 19 00:01:12 +0000 2019,jlespert,"Los que decían Mauricio es Macri, ahora dicen que Cristina no es Fernández. Despertar!! Macri y CFK hicieron y harán lo mismo!!",3289,685
Sat May 18 23:56:09 +0000 2019,jlespert,"Este simio le dice ""neoliberal"" a cualquiera mientras se trate de tirarle mierda https://t.co/f1Uh1bVl9a",1347,217
Sat May 18 21:44:04 +0000 2019,jlespert,Gracias Daniel! https://t.co/c2s4f6BKjA,788,90
Sat May 18 17:46:00 +0000 2019,jlespert,Buenos Muchachos https://t.co/1nm8t3Yrda,1314,200
Sat May 18 15:58:03 +0000 2019,jlespert,"Burda maniobra de Cristina tratando de desagrietar reflotando otra vez a sus amados 70 (oxímoron). Primero añorando a Gelbard y ahora designando a su secretario, A. Fernández, como candidato a Presidente. La versión SXXI del ""Cámpora al gobierno, Perón al poder""",6364,1738
Sat May 18 13:10:41 +0000 2019,jlespert,"CK premió a Boudou de Vice luego de robarnos los ahorros jubilatorios en las AFJP y ahora premia a otro secuaz como candidato a Presi luego q A.Fernández amenazara a jueces q investigan a CK. Por si fuera poco, miren lo q hizo apenas asumido Néstor https://t.co/OA67CSFhAp Horror",1485,462
Sat May 18 11:16:24 +0000 2019,jlespert,https://t.co/UuoiNdLIx3,546,95
Sat May 18 11:15:53 +0000 2019,jlespert,https://t.co/ut3eFjex3B,295,44
Sat May 18 11:15:40 +0000 2019,jlespert,https://t.co/i2QKwiSjLo,266,49
Sat May 18 11:15:22 +0000 2019,jlespert,https://t.co/m6WyBjazbj,119,22
Sat May 18 02:21:10 +0000 2019,jlespert,"Audio de mi participación hoy a las 9:30 AM en ""¿Y ahora quién podrá ayudarnos?"" de Ernesto Tenembaum por KZO https://t.co/cjl0zeysEe",209,38
Fri May 17 15:20:15 +0000 2019,jlespert,"Feliz Día de la Armada Argentina a todos sus integrantes! Pienso en uds. y en la enorme responsabilidad de cuidar los cuantiosos recursos de nuestro mar, sin nada. Pero lo vamos a hacer, aunque tengamos que empezar de cero. Todo mi respeto a las familias del ARA San Juan",4009,654
Fri May 17 14:40:07 +0000 2019,jlespert,Audio de mi diálogo con Gustavo Perez para @fmlibertadmol @misionesonIine de Misiones con motivo de mi visita a la ciudad de Posadas el Viernes 24/05  🔽 https://t.co/BO1b8sBvIv,110,18
Fri May 17 03:34:31 +0000 2019,jlespert,Video con mi participación en #NadaPersonal con @vivicanosaok por @canal9oficial Ayer a las 23:15hs https://t.co/aS9JNcC8Tr,292,54
Fri May 17 03:03:26 +0000 2019,jlespert,"Sería de las pocas actitudes honestas de #Cambiemos desde que asumió. Tomaron un montón de medidas económicas kirchneristas, inaguraron estatuas de Perón, la tienen a la Evita Amarilla de Vidal en BA, le dieron un platal a sindicatos y piqueteros, etc. Vamos, anímense chiques! https://t.co/nnIsOUZXNE",1202,218
Thu May 16 21:25:07 +0000 2019,jlespert,https://t.co/ft4rfdG87a,255,51
Thu May 16 17:32:11 +0000 2019,jlespert,"Esta noche a las 23,00 hs estaré en #NadaPersonal con @vivicanosaok por @canal9oficial https://t.co/neuEpVNJvx",475,95
